{
  "record_type": "ActivationRecord",
  "record_id": "pgw:l:0e40e40e40e40e40e40e40e40e40e40e",
  "created_at": "2026-08-04T06:01:00.000Z",
  "responsible_role": "trusted-activation-authority",
  "registry_snapshot_reference": {
    "registry_protocol_id": "project-gateway.registry",
    "registry_snapshot_format_version": "1.0",
    "registry_snapshot_id": "pgw:g:3fb51a11f2b23ba8c171326cbba7eb64",
    "registry_snapshot_digest": "sha-256:613112612ee7803db00c6e51826b3a63ee6ce6732b17c9b09ae8aff00db47c05",
    "protocol_compatibility": {
      "mode": "exact-release",
      "artifact_protocol_id": "project-gateway.artifact",
      "artifact_protocol_version": "1.0"
    }
  },
  "bundle": {
    "target_protocol_version": "1.0",
    "target_kind": {
      "id": "ExecutionBundle",
      "version": "1.0"
    },
    "target_instance_id": "pgw:i:064ee0ce2bdeee0073c6d64e93b9fb60",
    "target_revision_id": "pgw:r:c55e6e260130dc58d95c600ee51db65d",
    "target_digest": "sha-256:9a59a420a06f5e00f9529708918a2b9289bcb832aa8a4c983884520f5d6be3d7",
    "target_workspace_binding": {
      "mode": "bound",
      "workspace_id": "pgw:w:cf4339b1f56441936467dea1357dc30e"
    }
  },
  "workspace_id": "pgw:w:cf4339b1f56441936467dea1357dc30e",
  "required_issuance_record_ids": [
    "pgw:l:1f861271b89026e10ba7308ff03d913e",
    "pgw:l:8ccffec6c22e7a485528b68d6aa1a871",
    "pgw:l:a9d38ff863dc27e5c8214a0a44cede42",
    "pgw:l:aa97c2ef484a9f647ad4f57069216aa4",
    "pgw:l:dc228c1bd64ce5dd0daef99e69c7c3fc"
  ],
  "runtime_grant_id": "pgw:l:0e60e60e60e60e60e60e60e60e60e60e",
  "reserved_occurrence_id": "pgw:o:0e50e50e50e50e50e50e50e50e50e50e",
  "decision": "accepted"
}
